date,people_mentioned,places_in_kowel_mentioned,story_summary,story_keywords,
1924-01-13,Stefan Kłopotek,unknown,"An account of savings and financial practices with PKO in Poland, focusing on the introduction of new systems to curb speculative savings practices.",economy;financial systems;savings;speculation,
1924-03-11,"Jerzy-Władysław Jezierski, Żerard-Stanisław Jezierski, Adam Męciński",Łuck,"Report on the regulation of land ownership and property management in Łuck, reflecting administrative efforts to manage urbanization and land use.",property management;urbanization;administration;Łuck,
1924-01-13,"Fradl Perelmuter, Władysław Kolenko",unknown,"Details the registration of various properties in Łuck and nearby areas, as part of ongoing urban development and legal regularization efforts.",urban development;property registration;legal formalities;Łuck,
1924-01-13,Undersecretary of the Treasury,unknown,"Discussion of measures taken by the government to introduce new financial and postal systems, aiming to streamline communication and improve economic efficiency.",government reforms;communication;economy;postal systems,
1924-01-13,Bruno Terlecki,Łuck,"A reflection on the economic stagnation and development potential of Łuck, emphasizing the need for industrial growth and local initiative.",economic stagnation;industrial growth;local development;Łuck,
1924-01-13,"Naum Brigadir, Sebastjan Brigadir, Władysław Jezierski, Żerard-Stanisław Jezierski, Adam Męciński, Antonio Fil",Łuck;Serechowicze,"Property listings undergoing legal changes, highlighting an effort to reorganize and improve property management.",property management;legal changes;urban planning;Łuck,
1924-01-13,"Józef Budkiewicz, Antoni Żabielski, Stanisław Stanisławski, Antoni Fil",Łuck,The cooperative movement gains momentum in Łuck and surrounding areas with the establishment of consumer and agricultural societies.,cooperatives;community organization;local economy;Łuck,
1924-01-13,"Marshal Piłsudski, Engineer from Warsaw (unnamed), Maurycy Zamoyski, Stanisław Janicki, Engineer from Łuck (unnamed), P. Grabski, Stanisław Siedlecki, Naum Brigadir, Sebastian Brigadir, Duwid Wainsztein, Kisiel Gringurten, Maks Frindentul, Fradl Perelmuter, Władysław Grabskiego",Kowel;Maciejowska Street,"The newspaper discusses the political climate, key political events, and various social and economic issues in Poland. It includes mentions of legal reforms and planned projects to address war damages.",politics;economic development;social issues;legal reforms,
1924-01-07,"Abraham-Szymon Wajsenberg, Perla Zegen, Hersz Zegen, Bruno Terlecki, Wacław Król, Edward Omański, Taras Fedorczuk, Jeszioransz Szlacheckich, Marceli Biernacki, Włodzimierz Kolenko",Kowel;Serechowicze;Kołowerty,"A detailed report on the economic and industrial challenges facing the town of Łuck, alongside efforts to establish cooperatives to boost production and trade. It addresses the influence of local patriarchy and the initiative to set up modern industry.",economic challenges;industrial development;cooperative movements;Łuck,
1924-03-11,"Maurycy Zamoyski, Adam Męcinski, Jerzy-Władysław Jezierski, Żerard-Stanisław Jezierski",Kowel,"A detailed report on property ownership in Kowel, including the establishment of new legal frameworks and addressing past grievances. It discusses plans for future development.",property ownership;legal frameworks;development;pioneering projects,
1924-01-30,"Warsawska, Aleksandrowk, Siecławki, Józef Budkiewicz, Antoni Żabielski, Stanisław Stanisławski, Antoni Fil",Kowel,"Discussion of cooperative movements in Łuck and nearby areas, highlighting the potential growth through association and community efforts. These movements aim to improve economic conditions and build a network of cooperatives.",cooperative movements;community development;economic growth;association,
1924-01-13,"Marshal Piłsudski, Maurycy Zamoyski, Stanisław Janicki, Engineer from Łuck (unnamed), P. Grabski, Stanisław Siedlecki, Engineer from Warsaw (unnamed), Naum Brigadir, Sebastian Brigadir, Duwid Wainsztein, Kisiel Gringurten, Maks Frindentul, Fradl Perelmuter, Władysław Grabski",Kowel,"This section highlights the socio-political discussions and decisions made during a recent Polish cabinet meeting, including developments in the city of Łuck and changes in the electric power infrastructure.",politics;infrastructure;Łuck;development,
1924-01-06,none,Łuck,"Postal and telegraphic rate changes to be valorized starting January 8, 1924.",economic policy;postage;telecommunication,
1924-01-06,C. Gliklich,Jagiellońska,Announcement about a postal branch on Jagiellońska street.,business;postal services;advertisements,
1924-01-06,unknown,unknown,"A competition is announced by the magistrate of Dubno for the position of a city veterinary doctor, with applications due by January 16, 1924.",employment;government;veterinary,
1924-01-06,"pp. Chrzanowski, Janasz",none,"The government deploys representatives to sell surplus grain abroad as part of tax regulation efforts, to stabilize prices and aid taxpayers in paying property taxes with grain.",agriculture;taxes;international trade,
1924-01-06,Metropolitan Dionizy,Łuck,"Orthodox Metropolitan Dionizy protests against the intended restitution of a church in Łuck back to the Catholic community, urging consideration of Orthodox interests.",religious conflict;restitution;Orthodox Church,
1924-01-06,Franciszek Swoboda,none,"Franciszek Swoboda, a notable member of the Czech colony in Volhynia and owner of a machinery factory, passed away at age 71, with his factory to be continued by his sons.",obituary;Czech community;industry,
1924-01-06,none,Łuck,A meeting took place at the cinema-theater Czary' in Łuck concerning property tax,"with participation from local officials and citizens.""",
1924-01-06,Topczewski,Łuck,Staff at the Łuck Treasury Office worked intensely at the end of December to meet deadlines for selling industrial certificates.,bureaucracy;taxation;economic activity,
1924-01-06,none,Łuck,Meeting in Łucks Magistrate discusses city's reconstruction and beautification,"forming a ""Reconstruction Committee"".""",
1924-04-30,unknown,Łuck;Kiwerec,Rozkład jazdy i zmiany godzin odjazdów kolei w obwodzie,transport;cheduling;train service,
1924-05-05,unknown,Podłużne;Klewań;Trojanówka;Kiwerec;Kowel,Licytacja drewna różnego rodzaju z nadleśnictw województwa Wołyńskiego w miejscowościach w pobliżu Kowel,auction;lumber;Wołyń,
1924-04-16,"Prezes Sądu Okręgowego Jełowicki,Wice-Wojewoda Siedlecki,Ks. Baranowski",unknown,Organizowanie Komitetu Obchodu rocznicy Konstytucji 3 maja w Łucku z celem zbiórki funduszy,constitution day;fundraising;anniversary,
1924-04-30,Karol Waligórski,Kowel,Zgromadzenie lekarzy i działaczy sanitarnych w Łucku w celu omówienia rozwoju miast kresowych w Polsce,health meeting;urban development;Wołyń,
1924-04-30,unknown,unknown,Podjęcie działań normujących status prawny miast na Wołyniu z uwzględnieniem granic i stanu prawnego w miastach,urban planning;legal status;Wołyń,
1924-04-30,unknown,Kowel,Wprowadzenie waluty złotego w Polsce i harmonogram wymiany,currency reform;economy;monetary policy,
1924-04-30,León Trocki,Kowel,Wystąpienie Trockiego omawiające przewidywane konflikty w Europie,political tension;Europe;Trocki,
1924-04-30,unknown,Kowel,Organizacja i działania Kółek Rolniczych w Wołyniu wspierających rozwój rolnictwa i edukacji rolniczej,agriculture;education;cooperatives,
1924-04-08,"Minister of Finance Grabski, President of the Republic, Dr. Zielinski, Dr. Miłaszewski, Dr. Jasiński, Dr. Wojnicz",Łuck,"A report on the financial stabilization efforts led by Minister Grabski, highlighting the reduction of budget deficiencies and the fight against inflation with public support.",financial stabilization;government policy;grabski;economic reform,
1924-04-08,Engineer Haykowski T. Windyga,Kiwerce,Announcement about the lease availability of a brickyard near the railway station in Kiwerce.,real estate;business;industrial site,
1924-04-08,"Dr. Zielinski, Mieczysław Czarnecki, Helena Bączkowska, Konstanty Cychehl",Łuck,"Updates on the municipal improvements in Łuck, including plans for new streets, apothecary hiring, and municipal sanitation efforts.",infrastructure;public health;municipal development,
1924-04-08,"Wlodz. Garłow, Włodzimierz Neyman, Ł?kociński, Ursynowa, Garłowska, Rogalska Srokowska, Czachórska, Lenartowiczówna",Łuck,"Reports on various cultural activities in Łuck, including the Polish Theatre and performances by local artists.",cultural activities;theatre;performances,
1924-04-08,"Dr. Grabski, Dr. Zielinski, Mayor Zielinski",unknown,Discusses social and economic reforms needed in the border regions of Poland and the financial stability achieved by recent government measures.,regional development;economic policy;border regions,
1924-04-08,"Jarosiewieze, Maciej Trochimowicz, Marjanna Trochimowicz",Łuck,Report on the loss of personal documents by various residents in the Łuck region.,administrative matters;personal documents;Łuck,
1924-04-08,Władysław Cholewa,unknown,A brief announcement of a new parcel office opened by the Eastern Borderlands Society in Kowel.,postal services;business expansion;Kowel,
1924-04-08,Juljan Granzyński,unknown,Report on a fire outbreak in Juljan Granzyńskis house causing significant loss. ',fire incident;property damage;crisis,
1924-04-08,"p. Krasicka, Dr. Jasiński",Łuck,"Overview of educational and healthcare activities in Łuck, highlighting contributions to scientific publications and financial support to youth training.",education;health care;public policy,
1924-04-20,"Ks. Bochdan Jagodziński, Antoni Hermaszewski, Wawrzyniec Koźmiński, Fürst Jan, T. Harasimowicz, St. Rybakowski, W. Korniejewski",Kowel Parish Church,"Description of the weekly events at the Kowel Parish Church including a community gathering and agricultural lectures, highlighting the roles of local leaders and the emphasis on agricultural development.",community gathering;agricultutral development;local leadership,
1924-04-20,None explicitly named,Kowel,"Summary of financial and operational activities in Kowel, including announcements about the availability of loans and updates regarding local infrastructure projects.",financial updates;infrastructure;local government,
1924-04-20,None explicitly named,Kowel,Discussion about the cultural significance of Polish Easter traditions and the reflection on historical resilience and national identity in difficult times.,Easter traditions;national identity;historical resilience,
1924-04-20,"Franciszka Hejnego, St. Jagodziński, W. Koźmiński",Kowel Parish Church,"Report of lectures at the Kowel Parish Church, featuring presentations by local experts on topics like geology, agriculture, and livestock, aimed to educate and enhance the community’s operational knowledge.",education;agriculture;community development,
1924-04-20,"Michał Sawicki, Józef Lasczyk",Kowel,Update on administrative measures in Kowel including the restructuring of tax assessments and local government activities.,administration;tax policy;local government,
1924-04-20,"Stefan Borucki, E. Tonclet",Kowel,"Announcement about Polish representation in international scholarly discussions, mentioning the involvement of Polish scholars in astronomy and science communication.",astronomy;international collaboration;science communication,
1924-04-20,"Stanisław Wyspiański, Adam Mickiewicz",unknown,"Critique and reflection on the concept of Messianism within Polish literature, drawing on the works of major cultural figures to analyze past narratives of national destiny and moral challenges.",Messianism;literature;national destiny,
1924-04-20,None explicitly named,Kowel,"Discussion on Polish national spirit and Christian values during Easter, focusing on overcoming historical struggles and the symbolism of resurrection.",national spirit;Easter;Christian values,
1924-04-20,Ludwik Topór-Zwierzdowski,Opatów,"Commemoration of the 60th anniversary of Ludwik Topór-Zwierzdowski’s death, with a call for public participation in honor of historical significance and contribution to national memory.",commemoration;historical memory;national identity,
1924-03-13,"Józef Piłsudski, Wojewoda Srokowski, Pruchnik, Staniewicz, Skarżyński, Biskup Dubowski",Łuck,"A ceremonial academy was held in Łuck to honor Marshal Józef Piłsudski, attended by various dignitaries. Speeches highlighted Piłsudskis contributions to Polish independence and state organization. '",Józef Piłsudski;independence;state building;ceremony,
1924-03-25,"Zieliński, Wojewoda Wołyński, Stanisław Siedlecki, Adam Zaleski, Eugeniusz Starczewski","Łuck, Równe","This issue discusses topics such as the appointment of a new member to the Tribunal of State, Adam Zaleskis remarks during a discussion evening","and a ceremonial decoration of Stanisław Siedlecki.""",
1924-03-18,"Jan Ursyn-Zamarajew, Pruchnik","Łuck, Równe","Jan Ursyn-Zamarajew continues to work from bed due to illness, contributing material for the Dziennik Wołyński despite setbacks such as the illness of a typesetter.",work;illness;publishing,
1924-03-18,"J. Ursyn, Fejgel, Litwak","Łuck, Równe","Due to sickness and the inability to find a substitute typesetter, the publication schedule of Dziennik Wołyński' was disrupted","showcasing the challenges faced by small local publications.""",
1924-03-24,Biskup Dubowski,Łuck,The 25th anniversary of Biskup Dubowskis priesthood was celebrated with a ceremonial academy highlighting his contributions. ',anniversary;church;celebration,
1924-03-9,Zarząd Okręgowy Związku Strzeleckiego,Kowel,A meeting to discuss support for student youth and organizing a concert for P. M. S. was held by the district management of the Riflemens Association in Kowel. ',education;concert;youth support,
1924-03-17,Skolnicki,Unknown,"Plans to entrust the construction of the Bazyljański bridge to the engineer Skolnicki are underway, demonstrating local infrastructure development efforts.",infrastructure;engineering;construction,
1924-03-10,unknown,Łuck,"The city council of Łuck has decided to establish a free sugar depot, highlighting municipal trade and provisioning efforts.",trade;municipal government;depot,
1924-03-14,unknown,Łuck,"The magistrate in Łuck is organizing a public school for Jewish children with Polish language instruction, illustrating efforts towards educational inclusivity.",education;Jewish community;inclusivity,
1924-03-19,unknown,"Łuck, Równe","Several autobuses destined for Łuck are delayed by snow, a logistical challenge expected to be resolved with better road conditions soon.",transport;weather;logistics,
1924-03-19,unknown,Kowel,A thwarted escape attempt from Kowel prison where prisoners tried to tunnel through a wall suggests issues in local corrections and security.,prison;security;escape attempt,
1924-03-9,Bishop Dubowski,Łuck,Plans for a sanitation specialists convention in Łuck indicate regional health and sanitation improvement efforts.,health care;sanitation;conference,
1924-03-16,unknown,Łuck,"Discussions around the length of the workday during a reading club meeting in Łuck, showcasing the local engagement in labor and work conditions discourse.",labor rights;work conditions;reading club,
1924-03-15,revisionist,Kolki,"A letter to the editor explains a miscommunication involving an appeal in court, underscoring challenges in the local legal system.",legal system;communication;appeal,
1924-04-01,W. Witos (former Prime Minister),unknown,Analysis of Polands economic program discussing currency reform and challenges facing industry and agriculture',economics;currency reform;industry;agriculture,
1924-04-01,Stanislaw Karpinski (Bank Director),unknown,"Announcement about the opening of Bank Polski scheduled for April 28, with zloty currency to begin circulation May 1",banking;currency;economic reform,
1924-04-01,"Bishop Dubowski,Fr. Szmarbachowski",unknown,Celebration of Bishop Dubowskis 25th anniversary of priesthood in Luck diocese,"including special mass and academic ceremony""",
1924-04-01,Major Palubinski,Kowel,Report of flooding in Kowel with details of damage and military assistance provided,natural disaster;flooding;military aid,
1924-04-01,"Jankiel Szmuc,Lt. Zychon-Wirski",Rowne (corner of Kolejowa and 3 Maja streets),Court conviction of local tailor Jankiel Szmuc for attempted bribery of defense chief in espionage case,crime;bribery;espionage,
1924-04-01,"S. Namyslowski,Halina de Scibor Zieminska,A. Szlendak",unknown,Concert featuring violinist Namyslowski with opera singer Zieminska and pianist Szlendak performing classical works,culture;music;performance,
1938-03-XX,Youth of State Gymnasium in Kowel,State Gymnasium in Kowel;State Gymnasium J. Slowackiego;Francesco Nullo Regiment,"Students of State Gymnasium plan to fund machine gun for local Francesco Nullo Regiment, establishing special fund and organizing events for this purpose",youth initiative;military support;patriotic education,
1935-09-05,"Jozef Pilsudski,Legion soldiers",State Gymnasium building;Kowel,Article discusses 20th anniversary of Polish Legions entering Kowel under Pilsudskis command,"calls for collection of historical memorabilia""",
1938-03-XX,"Prelate Tokarzewski,Mgr Kubicki Zygmunt,Colonel Myszkowski",Monument Church in Kowel,"8, 000 faithful gather in Monument Church for prayer service protesting murder of priest in Lubon, with government and military representatives present",church;protest;religious solidarity,
1938-03-11,"Stanislaw Daniel,Jan Krol,Col. Myszkowski,Wanda Raczynska,Janusz Goncza,Fraciszek Ozdzanowski",Holuby;Kowel;Zdolbunow,"Train accident near Kowel - one killed, several injured when passenger train derails 5km from Kowel",train accident;casualties;transportation,
1938-03-XX,Mgr Parys Tadeusz,Kowel,"Report of theft at home of prominent social activist, with jewelry, documents and cash stolen worth 3000 zloty",crime;theft;local news,
1938-03-XX,"Inspector Panek Stanislaw,Marian Standa,Stanislaw Bara,Wienczyslawa Marynowska,Stefan Iwanicki,Emil Ciepielewski,Wanda Zeppowa,Dzikowska,Albina Nowosielska,Frankfurt,Feliks Nowosielski,Olimpia Solecka",Moscicki School in Kowel,General meeting of Polish White Cross local chapter reports on 10 years of activities and elects new board,organizational meeting;social work;elections,
1938-03-03,"Helena Zawadzka (defendant), Judge R. Grochowski, Prosecutor Demieńczuk, Attorney Cyngott Czesław",Kowel Municipal Court,Trial of the vice-mayors wife Helena Zawadzka on embezzlement charges results in acquittal due to lack of evidence',court trial;acquittal;local government,
1938-03-06,Fr. Dean Tokarzewski,Memorial Church,Announcement of special memorial service in Kowels Memorial Church in response to communist attack on church in Luboń near Poznań',religion;anti-communism;memorial service,
1938-unknown,unknown railway engineers,unknown,Railway engineers association held tea gathering and collected 20. 80 złoty donation for orphanage run by Missionary-Benedictine Sisters in Kowel',charity;railway workers;orphanage,
1938-02-28,"President Bednarski, Chmielewski, Engineer Krukowski, Engineer Moczulski, Ciepielowski, Konczakowski, Zakrzewski, Bajus, Górnacz",City Hall; New Kowel district; Turia River,"Detailed report on city council budget meeting discussing infrastructure improvements including new school construction, street paving, and river regulation",local government;urban development;infrastructure,
1938-unknown,"Director Bakuliński, Edward Żyłowicz",unknown,Motorcycle Club of the Riflemens Association held meeting to discuss workshops,"fuel station and transportation discounts for members""",
1938-unknown,Dr. Witold Ratajski,unknown,"Local doctors collect 1, 060 złoty for National Defense Fund",healthcare;military support;donations,
1938-03-27,"Marshal Edward Śmigły-Rydz, President Alfons Bednarski, Karol Niementowski, Micielski, Artist Przeradzka","City Hall, State Gymnasium, Railway Station, Marshal Piłsudski Avenue",Kowel city council awards honorary citizenship to Marshal Śmigły-Rydz; special delegation travels to Warsaw to present diploma featuring artwork of historical Kowel locations,honorary citizenship;military leadership;local government,
1938-03-27,"Col. Gwido-Kawiński, Gen. Juliusz Drapella, Victoria Najzarkówna, Józef Kwiatkowski, Governor Kubicki, President Bednarski","Kowel, Maciejów, Nowa Dąbrowa, Budy Ossowskie, Doszno, Turzysk, Maniewicze, Hołoby",Interview with Scout Friends Circle chairman reveals extensive scouting activities in Kowel region with 770 youth members and plans for new scout house construction,scouting;youth organization;community development,
1938-03-27,"Waleria Pankowa, W. Marynowska","ZPOK (Womens Civic Work Union) headquarters""",Womens Civic Work Union holds gathering to congratulate chairwoman Waleria Pankowa on receiving Cross of Merit',"women""s organizations;civic work;awards",
1938-03-27,"Prof. M. Zarembiński, Staś Zarembiński, Mgr. B. Sygut, Basia Kubicka",Światowid Cinema,"Charity musical and spoken word evening features choir performances, violin solos, folk dances and comedy skits to benefit the unemployed; raises about 500 złoty",charity event;cultural performance;community aid,
1938-03-27,"Dr. Franciszek Ksok, Prof. Józef Bączkowski, Dr. M. Szpak, Gen. Juliusz Drapella, Maj. Iwaszkiewicz, Lt. Budzyński",School of President Mościcki,Sports events report: Volleyball tournament results and Ice Hockey Association meeting details including new board election,sports;volleyball;ice hockey,
1938-03-27,"Moroz Zinowi, Aleksandra Pieczaruk, Dubuk Barbara, Makar Kociubko, Józef Łucki, Steblowiec Pankracy, Izaak Wajnberg, Kacyn Bechen","Szkroby, Ozierany, Głuchy, Kortelisy, Sielce, Radoszyn, Lipiny, Zabłocie","Police chronicle reports multiple drownings, suicide attempt, fires, and robbery in various locations around Kowel district",accidents;crime;local news,
1938-03-27,"Piotr Jakubowicz, F. Szworak, Wasyl Prystupczuk","Municipal Court, Hay Market Square",Court sentences two men to one month arrest each for unfair competition and fraud,court case;business crime;legal proceedings,
1938-03-27,"Henryk Konieczko, Michał Gryniuk","State Gymnasium Museum, Włodzimierska Street",Museum receives donations of historical coin and fossil specimens from local residents,museum;local history;donations,
1938-02-20,"Judge Ryszard Grochowski, Maj. Edmund Iwaszkiewicz, Engineer Władysław Krukowski, Judge Stefan Lorenc, Władysław Markowski, Zofia Rybkowa, Prosecutor Marian Szpak, Edward Sambor, Attorney Władysław Szymkiewicz",Polish Educational Society headquarters,Polish Educational Society (PMS) holds meeting and passes resolution emphasizing need for Christian-national education; elects new board and plans new building construction,education;nationalism;Christianity,
1938-02-20,"Fr. Mgr. Iwanicki, Ms. Kocemowna, Ms. Żarska, Mgr. Nigborowicz, Chief Rycerz, Mgr. Jędrysik, Dr. Naskręcki, Prof. Stypułkowski, Mr. Pyzik",Myślina-Rudniki,New Peoples University opening in Myślina-Rudniki to provide Christian and Polish cultural education to local population',education;cultural development;rural development,
1938-02-20,"Major Iwaszkiewicz, Prof. Korfanty, Mrs. Zadarnowska, Mrs. Sternikowa, Capt. Potocki",Polish Hearth (Ognisko Polskie),Successful charity dance organized by PKU Kowel to benefit public school in Julianów; well attended by local civil and military society,social events;charity;military,
1938-02-20,Fr. Bazyli Warwarow,Powursk,Local Orthodox priest and agricultural circle president makes controversial proposal for army to pay compensation for using local roads; proposal rejected,military;local politics;controversy,
1938-02-20,Stanisław Wąsik,State Gymnasium Museum,Local bank official donates three historic Polish coins to the Museum of Kowel Region,museum;local history;donations,
1938-02-20,"Janina Radzikowska, Waleria Pankowa, Mrs. Czerniachowiczowa",ZPOK headquarters,Womens Civic Work Union (ZPOK) expands activities with new daycare centers and educational programs for mothers and domestic workers',"women""s organizations;social work;education",
1938-02-20,"[murder victim] Chotyńska, Katarzyna Chotyńska, Oksenia Chotyńska, Pantelejmon Mostepaniuk",unknown,Court case details murder of mother of six children; prosecutor demands death penalty but perpetrator receives life sentence,crime;court;justice,
1938-02-20,"Halina Dorée, Zofia Sławińska, Bronisław Kassowski, Piotr Orłowski, Edward Czerwiński, Stanisław Dębicz, Stanisław Purzycki",Wołyń Theater,Review of theatrical performance Gra serc' (Game of Hearts) by Stefan Biedrzyński; praised for acting and staging',theater;culture;entertainment,
1806-01-01,"Bartoszewicz Ryman family, Bona (Queen)",Turin River; Warsaw Street; Szewczenko Street; Old Railway Street,"Historical description of Kowel in 1806, detailing the layout of streets, buildings, and geographical features.",historical description;urban development;geography,
1938-03-06,"Konczakowski (president), Woś Józef (OZN secretary), Marshal Śmigły-Rydz",Warszawska Street; Real Estate Owners Association headquarters,"A property owners meeting votes to donate 10, 000 złoty for the purchase of a machine gun for the army; the initial collection raises 600 złoty from 46 attendees.",military support;property owners;patriotism,
1938-02-06,unknown,All of Kowel,"Lead editorial calling for public bathhouse, water supply, and sewage system to fight tuberculosis in Kowel; criticizes current anti-TB efforts as insufficient",public health;infrastructure;tuberculosis,
