date,people_mentioned,places_in_kowel_mentioned,story_summary,story_keywords,
1938-02-06,"Fr. Tokarzewski, Eng. Godowski, Attorney Grekk",Catholic Work House,"Catholic Action holds traditional wafer-sharing ceremony and celebrates name day of Fr. Tokarzewski, praising his patriotism and past exile to Siberia",religion;Catholic organizations;celebrations,
1938-02-06,unknown,"Memorial Church, schools",City celebrates Presidents name day with decorated buildings,church service attended by government officials,
1938-02-06,unknown,KPW Community Center,Anti-alcoholism propaganda academy and tea dance planned to demonstrate possibility of entertainment without drinking,social issues;temperance;entertainment,
1938-02-06,Fr. J. Szumowski,Kowel region,Delegate of State Archaeological Museum calls for preservation of archaeological artifacts in Kowel region and creation of regional museum,archaeology;cultural preservation;museums,
1938-02-06,"Queen Bona, Henryk Wójcik","Mielnica, Nowa Wyżwa","Article describes local legends about Queen Bona and archaeological finds in the region, including ancient tools and coins",local history;archaeology;folklore,
1938-02-06,"Capt. I. Potocki, Attorney Zygmunt Grekk",Civic Club,Polish Western Union holds carnival dance to benefit Polish children in Germany; Attorney Grekk chosen as Carnival Prince,social events;charity;Polish minority rights,
1938-02-06,"Jan Konował, Henryk Partycki, Trofim Skuliniec, Józef Kiszner",Various Kowel locations,"Police chronicle reports attempted suicide, missing person, and fraud cases by portrait agents",crime;accidents;local news,
1938-02-06,"J. Domańska, E. Szafrański, Ms. Krzywicka, Mr. Preiss, Mr. Iwański",Wołyń Theater,Review praises performance of play Jan' by Bus Fekete for excellent acting and meaningful message about human equality',theater;culture;entertainment,
1938-02-27,"Franciszek Skrzec, Stanisław Wąsik",State Gymnasium Museum,Museum receives important archaeological finds including petrified pine bark and ancient coins; specimens date back millions of years,archaeology;local history;museum collections,
1938-02-27,"Biernacki, Bajko, Studziński, Kruglus, Witryk, Krupiński, Eng. Moczulski, Wajsman",Various Kowel locations,Detailed analysis of city development committees failures and recommendations for improving housing conditions through better implementation of development laws',urban development;housing;local government,
1938-02-27,Fr. Tokarzewski,Kowel Parish,Historical document from 1839 lists villages belonging to Roman Catholic parish in Kowel; shows extent of Polish property confiscations after 1831 uprising,church history;Polish history;property rights,
1938-02-27,"Prof. W. Krukowski, Fr. Porębski",Maritime and Colonial League,Youth academy celebrates Polands access to sea with performances and speech emphasizing importance of naval development',maritime affairs;youth organizations;patriotism,
1938-02-27,"Edward Bender, Tadeusz Kowalski, Sergiusz Nadgryzowski",State Gymnasium,"Detailed review of Ormuz concert featuring bass singer, cellist and pianist; discusses state of musical culture in Kowel",culture;music;entertainment,
1938-02-27,Maj. Kiełkowski,Hrywiatki,Infantry Regiment from Kowel provides support to school in Hrywiatki through donations of supplies and funding for poor children,military;education;charity,
1938-01,"B. Wojciechowski, D. Celiński",Railway Station,Railway workers cafeteria reports impressive annual results: served 68,940 meals at 35 gr,
1938-01,Mojsze Perel,City Cinema,"Jewish community leader wins control of former municipal cinema, renaming it Światowid'; seen as symbolic victory over Polish cultural interests'",cinema;cultural conflict;Jewish-Polish relations,
1938-01,A. Kiemirzanka,ZPOK headquarters,Young Womens Circle of ZPOK (Women's Civic Work Union) pledges entire year's income to National Defense Fund',"women""s organizations;patriotism;military support",
1938-01,Dymitr Materdej,State Gymnasium,Former student of Słowacki Gymnasium rearrested on communist charges after previous acquittal,communism;education;law enforcement,
1938-01,Fr. Franciszek Andruszewicz,"Buceń, Kowel Hospital","Death of Fr. Andruszewicz, parish priest who had been imprisoned by Bolsheviks; praised as patriot",clergy;obituary;anti-communism,
1938-01,"Prof. Zarembiński, Dr. Marian Szpak",Catholic Work House,Lutnia' choir plans carol concert to benefit Memorial Church construction',culture;religion;charity,
1938-01,"Col. Stanisław Bobrowski, Stanisław Woźny, Jan Popow, Stanisław Lorczak, Jan Gumienny","Legionnaires Club""",New branch of Polish Army Veterans from France established in Kowel with about 20 members,veterans;military;organizations,
1938-01,"Dr. Wacław Weselski, Józef Woś",unknown,Two organizational meetings held to establish Camp of National Unity (OZN) branches in city and rural areas,politics;national unity;organizations,
1938-01,W. Gołębiowski,"Kowel, Włodzimierz","Article criticizes unqualified people creating building plans and licensed engineers signing them without review, harming architectural standards",construction;professional standards;fraud,
1938-01,Lucyna Munkowa,Police Family headquarters,"Police Family Association reports on activities supporting widows and orphans of police officers, including library, events and charity work",police;social welfare;charity,
1938-01-06,Editorial Staff,Warszawska Street,Newspapers inaugural editorial announcing mission to support Christian merchants and craftsmen,combat social ills,
1938-01-06,unknown,Queen Bona Street,Announcement that TNSW plans to build new building for commercial high school which will serve as center for merchandise testing and consumer protection for Volhynia region,education;commerce;consumer protection,
1938-01-06,Judge Stefan Lorenc,Catholic Work House,"Judge gives well-attended lecture on communism in Poland, describing it as foreign movement funded by Moscows Comintern'",anti-communism;public lecture;politics,
1938-01-06,"President Bednarski, Mojsze Perel, Attorney Romanow, Biernacki, Niementowski, Inspector Panek","City Hall, Municipal Cinema",Detailed report of city council meeting where decision made to sell municipal cinema to Jewish businessman Perel despite opposition,local government;cultural institutions;Jewish-Polish relations,
1938-01-06,"K. Sarnecka, E. Fertner",Volhynia Theater,Critical review of light comedy Family Scandal' performed by Volhynia Theater company',theater;culture;entertainment,
1938-01-06,Jan Grochowski,Christian Interest-Free Loan Office,Report on reorganization and activities of Christian Interest-Free Loan Office providing loans to merchants and craftsmen,finance;Christian business;social assistance,
1938-01-06,Józef Woś,Public School No. 1,Rifle Association organizing two-week training course for 30 rural community center leaders,civic organizations;rural development;education,
1938-01-06,Piotr Luciuk,Dolsk,Report on 1000-member evangelical Christian sect in Dolsk led by farmer-preacher claiming divine gift for Biblical interpretation,religion;sects;rural life,
1938-01-06,"Anna Wacława Ulbrychówna, Mrs. Markowiczowa, Dr. Naskręcki, Fr. Żukowski",Mościcki Public School,Student president describes Polish Red Cross youth circle activities including correspondence with Japan and America,youth organizations;charity;international relations,
1938-01-06,"Fedor Slipczuk, Radion Borysiuk, Judge Gąsiorowski, Prosecutor Marian Szpak",District Court,Court sentences man to 2 years prison for planting communist leaflets on neighbors property in revenge over land dispute',law enforcement;communism;rural conflict,
1938-01-29,"Marian Lamparski, Piotr Formejster, Matejko, Pinkus, Prosecutor Antoni Woźniak, Judge Stefan Lorenc, Commander Tomiak",Myzowo,"Train derailment near Myzowo caused by sabotage of track switch; six people injured and seven cattle killed; damage estimated at 65, 000 złoty",railway accident;sabotage;law enforcement,
1938-01-30,"Władysław Madejski, Fr. Tokarzewski, Karol Niementowski",Military Cemetery,Solemn funeral held for former legionnaire and railway worker decorated with Independence Cross; priest provided free burial plot,veterans;funeral;social solidarity,
1938-01-30,Vice President Zawadzki,City Hall,"City council meeting approves joining weaving cooperative, taking over public library, and joining regional social welfare association",local government;social welfare;urban development,
1938-01-30,Helena Gutowska,unknown,Letter to editor about animal cruelty sent to Society for Prevention of Cruelty to Animals in Warsaw,animal welfare;social activism;correspondence,
1938-01-30,"Fr. Piotrowski, Maj. Szadbej, W. Osiński",Railway Family Cafeteria,Veterans Association holds traditional wafer-sharing ceremony commemorating 75th anniversary of January Uprising',veterans;patriotic celebrations;social events,
1938-01-30,"Maj. Iwaszkiewicz, Capt. Potocki, Sgt. Wierzbiński, Gajewski, Stefan Nowak",Julianów,"Military recruitment office adopts school in remote Julianów village, providing gifts and support for 87 children",education;military-civilian relations;charity,
1938-01-30,Nestor Demchuk,Rudka,Court sentences man to one month arrest for failing to extinguish forest fire that burned 4 hectares,law enforcement;forest protection;rural life,
1938-01-30,Anna Turczyn,Monopolowa Street,Single mother abandons one-year-old son outside orphanage due to poverty; court acquits her due to necessity,social issues;poverty;law enforcement,
1938-01-30,Walerian Gołębiowski,various Kowel locations,"Extended critique of unqualified people creating building plans and licensed engineers signing them without review, harming architectural standards",construction;professional standards;urban development,
1938-01-23,unknown,various Kowel locations,Ministry assigns 12 unemployed teachers to teach pre-military youth; 10 will work in Kowel district,education;literacy;military preparation,
1938-01-23,"Feliks Słowik, Mieczysław Łęczycki, Jan Godlewski",Łucka Street,New Christian Craftsmen and Merchants Bank to open February 15 to provide savings accounts and loans',business;Christian commerce;banking,
1938-01-23,Markus Rojzen,unknown,Editorial response to Jewish newspapers criticism of Ziemia Kowelska as anti-Semitic,"defending paper""s pro-Christian business stance""",
1938-01-23,"Józef Matusiewicz, Prosecutor Szpak",District Court,Court case of mentally ill man accused of attempting to burn fathers house; sentenced to 1 year prison and psychiatric care',law enforcement;mental health;criminal justice,
1938-01-23,Walerian Gołębiowski,Powursk,"Engineer reports finding iron ore and oil-bearing sand near Powursk, suggesting mineral wealth in Volhynia region",natural resources;geology;economic development,
1938-01-23,"Prof. Zarembiński, Mrs. Silicka, Mr. Giza, Mr. Dębicki, Mrs. Kabacińska, Mr. Żarski, Dr. Marian Szpak",Catholic Work House,Detailed review of Lutnia' choir's Christmas carol concert to benefit Memorial Church construction',culture;music;religion,
1938-01-23,"Feliks Nowosielski, Mrs. Jelenkowska, Mr. Didkowski",Public School No. 7,Students celebrate school principals name day with flowers and donations for poor students' clothing',education;charity;school life,
1938-01-23,Krzysztof Gawryś,Mielnica,"Historical description of Mielnica town and ruins of Czarniecki castle, discussing local legends and architectural heritage",local history;cultural heritage;architecture,
1924-10,"Leon Kisiel, Leon Malinowski",State Gymnasium,Editorial lamenting lack of student contributions to school magazine and calling for renewed engagement,student journalism;school life;editorial,
1924-10,unknown,unknown,Essay discussing role and responsibilities of youth in rebuilding Poland after WWI and importance of education,youth;patriotism;education,
1924-10,"Klementyna Hoffmanowa, Emilia Plater",unknown,Historical article about womens roles during November and January Uprisings,"highlighting heroism and patriotic contributions""",
1924-10,Professor Łukasiewicz,"Warsaw, Brest, Zabłocie","First part of detailed travelogue about school excursion to Warsaw, Grodno, Vilnius and Białowieża Forest",school trips;student life;travel,
1924-10,unknown,unknown,Poetic works by students including Do Młodych' (To the Young),"""Smutno mi"" (I""m Sad) and other reflective poems""",
1924-10,unknown,unknown,"Technical article about proper football training and technique, emphasizing need for physical preparation and teamwork",sports;physical education;athletics,
March 28,1924,Mieczysław Wojtowicz & Roman Orlicz,Theater Hall,"Cultural and educational morning event featuring recitations: ""About Work""",
"April 5, 1924",Fredro (playwright),Theater Hall,Drama Club performed 'Maiden Vows' by Fredro. Performance was unsuccessful due to poor preparation from constant cast changes and inappropriate behavior of audience especially some scouts. The play 'fell on all four paws' (failed completely).,theater;drama club;student performance;failure;audience behavior,
"April 6, 1924",Fredro (playwright),Theater Hall,Second performance of 'Maiden Vows' - better acting but very poor attendance.,theater;drama club;low attendance,
April 7-8 1924,Father Zyrniewski,Not specified,Traditional Easter retreats and confession with large student participation. Military chaplain Father Zyrniewski delivered moving sermons that deeply touched many hearts and convictions.,religion;Easter;student participation;spiritual guidance,
"April 15, 1924",Director Laskowski,Not specified,Collection for Polish Bank shares closed. Thanks to Director Laskowski's short-term loan the school youth purchased 5 shares not counting shares from classes VII and VI-b. Detailed collection results and remaining debts to be announced in next issue.,finance;student initiative;bank shares;school fundraising,
"May 9, 1924",Marian Angielus & Promień editors,Not specified,Editorial Committee expelled Marian Angielus (4th grade scout) for plagiarizing articles from other youth magazines. Committee questions why Promień magazine editors haven't responded about this issue or replied to letter sent April 26.,scandal;plagiarism;editorial integrity;communication,
"May 25, 1924",Not specified,Not specified,Announcement of general student meeting regarding future publication of 'Na Kresach' magazine and forming new editorial team.,student magazine;editorial changes;organization,
Ongoing,Prof. Jan Kucy & Editorial staff,Not specified,Editorial note discussing slow development of school magazine due to lack of student contributions. Single editor had to fill content leading to publication delays. Appeals for more student involvement.,student magazine;editorial challenges;participation,
Not specified,Lady Dzen & Leszek biały & Various student authors,Not specified,Editorial responses to various submitted works: Rejected pieces include 'Migawki' 'Slupy' 'Memories from Bolshevik Times' 'Scary Room' and various poems and puzzles for various quality issues.,editorial feedback;student submissions;writing quality,
Post-Easter 1924,Not specified,Not specified,Humorous article about extended Easter break and students' reluctance to return to studies. Describes various justifications for extending vacation and eventual return to school.,student life;humor;holidays;school attendance,
"November 12, 1924",Maria (student),Kowel,Death notice for Maria,a student of Kowel Gymnasium who was described as a model student and best friend to her colleagues.,
"November 8, 1924",Antonina Halina Rusilowiczowna,Kowel,Death notice for Halina Rusilowiczowna,a Warsaw University student and Kowel Gymnasium graduate who contributed articles to the magazine.,
"October 18, 1924",M. Nocuń & T. Jachimowicz & A. Wierzbicki & A. Rudnicki,Gymnasium Hall,Historical-Literary Circle performed two comedies: 'The Dowried Only Daughter' and 'That's Politics'. First play featured strong performance by M. Nocuń though A. Wierzbicki's role as Blazej slowed the tempo.,theater;student performance;comedy,
"October 26, 1924",E. Popławska & Szampowalska & M. Nocuń & Kopelczukówna & Zakrzycki & Malinowski,Express Theater,Repeat performance of 4-act comedy 'Hajduczek' at public request. Best performances by returning cast members playing Basia Krysia Zagloba and Makowiecka. New casting of Ketling role considered less successful.,theater;public performance;casting,
"November 22, 1924",Prof. Bernasowska & Prof. Kitlowa,Gymnasium Hall,Evening of vocal-dramatic-musical performances organized by LNOPP and Red Cross circles. Notable performance of comedy 'Grubasek' by youngest students especially the lead role.,entertainment;student performance;charity event,
Ongoing,Leon Kisiel & L. DN Malinowski,Not specified,Editorial note mentioning greater student interest allowing 9th issue publication. Acknowledges imperfections due to student writers still developing their skills.,editorial;student publication,
Ongoing,Multiple students,Not specified,Report on Historical-Literary Circle activities including organization structure election of officers weekly meetings and series of lectures on Polish history and literature with subsequent discussions.,student organization;academic circle;lectures,
"January 27, 1924",Not specified,Gymnasium Theater,Final year students performed Fredro's 'Zemsta' (The Revenge). Performance was better than previous school shows due to good preparation despite some minor set design issues. Particularly strong performances by students playing Cześnik and Papkin roles.,theater;student performance;drama,
Not specified,Prof. Jan Kucy,Not specified,Editorial note explaining delay in publication due to heavy workload before March 10 exams and printing house issues. Announces magazine will now be published on 15th of each month.,editorial;publication delay;announcements,
Ongoing,Multiple students,Not specified,Report on school social events including two successful student dance parties during carnival season before the March 10 exam period.,student life;social events;carnival,
Ongoing,Grzesikowska & Szampowalska & Włodarska & Jacuńska,Not specified,Thanks to female students who help sell the magazine to broader society and to donors including town president Waligórski Mr. Rudnicki and Prof. Hanna Gembarzewska.,fundraising;distribution;acknowledgments,
Upcoming,Not specified,Gymnasium Theater,Drama Circle preparing to perform 'The Maiden Vows' and 'The Return of the Deputy. ',theater;upcoming performance;drama club,
Ongoing,Multiple students,Not specified,Report on student subscriptions to Polish Bank shares with class presidents and delegates collecting contributions. Director's loan helped purchase shares.,finance;student initiative;bank shares,
Not specified,Multiple students,State Gymnasium Kowel,Published list of student donors who contributed gifts for poorest children at Kowel orphanage Christmas event. Lists students by class from grades I-VII.,charity;donations;community service,
"January 22, 1924",Jaś Wdziękoński,Not specified,Death notice for first-year student Jaś Wdziękoński from infectious disease. Limited attendance at funeral due to infectious nature. Editorial expresses condolences to grieving parents.,death;student;condolences,
"January 27, 1924",Jan Bojanowicz,Gymnasium Theater Hall,After Sunday mass Jan Bojanowicz (7th grade) delivered concise but substantive lecture about January Uprising. Event ended with singing of 'Rota' in uplifted spirits.,lecture;history;student presentation,
"January 6, 1924",Multiple students,Gymnasium,Parents' Committee organized Christmas tree event and dance party. Younger classes enjoyed free buffet from 5-10pm while older students danced from 10-12pm. Event featured mandolin orchestra and dance demonstrations.,social event;holiday celebration;student party,
"January 26, 1924",J. Szampowalska & J.K. Sikorski & Samicki & Rost & Kozłowski & Stefanek & W. Sztajer,Theater Hall,Joint academic ceremony by Surveying School and Gymnasium commemorating January Uprising anniversary. Featured recitations poetry music and opening speech by Prof. Sikorski.,commemoration;academic ceremony;joint schools event,
"December 9, 1923",Multiple students & Flachówna & Nocuń,Gymnasium Theater,Drama Circle performed one-act comedy 'The Lecturer' plus monologues. Despite small audience strong performances especially by Flachówna and Nocuń. Poor attendance from wider society noted.,theater;student performance;drama,
"December 16, 1923",Multiple students & Czarnouski & Z. Popławska & Konikowska & Stefanek & S. Brandt,Not specified,Friends of Scouting Circle performed two comedies 'Suspicious Person' and 'Bewitched Błażek' plus Krakowiak dance. Notable performances by multiple students under direction of S. Brandt.,theater;scouting;performance,
January 1924,K. Waligórski & Multiple donors,City Hall,Detailed list of donations collected by city officials in lieu of New Year's wishes to Mayor Waligórski for Parents' Committee fund at Gymnasium. Total collected: 7985000 marks.,fundraising;donations;parents committee,
"January 21, 1924",Hanna Gembarzewska & Bernasowska & Janina Kostrzewska,Gymnasium,Red Cross Circle at Gymnasium began activities with over 50 members. Aims to improve school hygiene. Appeals for more participation from upper classes.,student organization;health;red cross,
Upcoming February 1924,Not specified,Kowel,Announcement of new Commercial School opening with 3-year course approved by Ministry. Monthly tuition approximately 15 zloty plus 3 zloty exam fee.,education;new school;announcement,
1924-05-16,"Waclaw Sztajer, Jan Kazimierz Sikorski, Adam Godowski, Stanislaw Kamienski, Karol Waligorski, Waclaw Krolewski, Ludwik Rzeszowski, Malkiewicz, Wojcik, Kalinowski, Rzeszowska, Chochowski, Rudnicki, Prokurat Lewinski, Wielhorski, Mroczkówna, Dziezkaniec","Kowel, Gimnazjum P, Szkola Miernicza i Drogowa",School news and updates from Kowel; celebration of May 3rd Constitution Day; opening of Peoples University; May dance organized by Friends of Fraternal Aid; 5th anniversary of 50th Infantry Regiment's return to Poland; sports competitions',"Fraternal Aid, Constitution Day, Peoples University",
"February 24, 1924",Mr. Szulc (chairman),Assembly Hall of State Control Chamber (Królowej Bony Street),Parliamentary delegates and senators held a conference and academy in Kowel. The event included a mass at the parish church followed by meetings and speeches about supporting Poland's eastern borderlands.,parliament,
"February 18, 1924",Dr. Królewski (chairman) & Mr. Szulecki (secretary),Railway Hall (3rd Mechanical Division),The School Support Society (Macierz Szkolna) board meeting allocated 612 million marks to the Student Aid Association and 130 million marks to a kindergarten for poor railway workers' children.,charity,
"February 17, 1924",Ruta (lecturer) & Prof. T. Żuława & Prof. S. Kamieński & Prof. J.K. Sikorski,School Theater Hall,Educational Section of the Student Aid Association held its first lecture about the history of Polish Parliament followed by a meeting to discuss future activities.,education,
"March 9, 1924",Koszowski Henryk (president) & Dziczkaniec Józef (vice president) & Rost (secretary) & Pencker Ryszard (deputy secretary) & Stryjecki Jan (treasurer) & Citkowicz and Linkiewicz (board members),Local Gymnasium Hall,All-Polish Youth Union (Związek Młodzieży Wszechpolskiej) established a new chapter at the Surveying and Road School with 26 members voting to form the organization.,student organization,
"January 26, 1924",None,State Gymnasium,The Student Aid Association organized an academy commemorating the January 1863 Uprising. The program included a lecture about the uprising,recitations,
"January 20, 1924",Dziczkaniec (lecturer),None,Educational Section of Student Aid organized a lecture on 'Formation of Polish Armed Forces in the North-Eastern Borderlands of Poland' attended by 30 members followed by lively discussion.,lecture,
"December 2, 1923","B. Nowakowska, L. Latówna, W. Giza",Military Community Center,Student Aid Friends Circle organized a dance that raised 44. 995 million marks net profit which was used to help underprivileged students. Special thanks given to the protectors and donors who contributed to buffet.,fundraising,
"January 27, 1924",None,State Gymnasium,Theatre circle of graduating students performed Aleksander Fredro's 'Zemsta' (The Revenge). While younger members of society attended numerously the older generation maintained their tradition of non-attendance except for teachers.,theatre,
"January 27, 1924","Fr. Sznarbachowski (chairman), Stefanek, Dziczkaniec",State Gymnasium Building,General meeting of School Support Society (Macierz Szkolna) members was held. Student Aid delegation presented their organization's history and requested material support for their dormitory which was promised by the assembly.,meeting,
"February 20, 1938",Konczakowski (president) & Woś Józef (secretary),None,Property Owners Association meeting voted to donate 10,000 zloty to purchase a machine gun for the 50th Infantry Regiment. 46 members immediately pledged 600 zloty during a 5-minute break.,
"March 3, 1938",Judge R. Grochowski & Helena Zawadzka & Prosecutor Demieńczuk & Attorney Cyngott,Municipal Court,Helena Zawadzka (wife of vice-president) was acquitted in a sensational embezzlement case due to lack of evidence. Multiple witnesses gave conflicting testimony.,court case,
"March 6, 1938",Fr. Tokarzewski (dean),Monument Church,Expiatory church service scheduled in response to a communist crime committed in a church in Luboń near Poznań. Dean called for all Catholic organizations to attend with their banners.,church service,
None Listed,None Listed,Sisters of Missionary-Benedictines Orphanage,Railway Engineers Union branch in Kowel held a tea party where they collected 20. 80 zloty for the local orphanage.,charity,
